{
  "$schema": "https://json-schema.org/draft/2020-12/schema",
  "$id": "https://basidiocarp.dev/septa/command-output-v1.schema.json",
  "title": "Command Output v1",
  "description": "Mycelium routes large command outputs to Hyphae for chunked storage via the hyphae_store_command_output MCP tool. Producer: mycelium/src/hyphae_client.rs. Consumer: hyphae-mcp/src/tools/ingest.rs.",
  "type": "object",
  "required": ["schema_version", "command", "output"],
  "properties": {
    "schema_version": {
      "const": "1.0",
      "description": "Contract version. Receivers should reject unknown versions."
    },
    "command": {
      "type": "string",
      "minLength": 1,
      "description": "The command that produced this output (e.g., 'cargo test')."
    },
    "output": {
      "type": "string",
      "description": "Raw command output to be chunked and stored."
    },
    "project": {
      "type": "string",
      "description": "Project name for scoping. Auto-detected from git root if omitted."
    },
    "project_root": {
      "type": "string",
      "description": "Canonical filesystem path to the repository root. Part of identity pair."
    },
    "worktree_id": {
      "type": "string",
      "description": "Git worktree identifier. 'main' for primary, worktree name for linked."
    },
    "ttl_hours": {
      "type": "integer",
      "minimum": 1,
      "maximum": 168,
      "default": 4,
      "description": "Time-to-live in hours for the stored chunks. Default: 4 hours."
    },
    "runtime_session_id": {
      "type": "string",
      "description": "Claude Code session ID at time of emission. Emitted by mycelium when spore::claude_session_id() is available. Optional."
    }
  },
  "additionalProperties": false
}
