{
  "schema_version": "1.0",
  "command": "cargo test",
  "output": "running 247 tests\ntest filters::git::tests::test_log_format ... ok\ntest filters::git::tests::test_status_format ... ok\ntest filters::cargo::tests::test_build_output ... ok\n...\ntest result: ok. 244 passed; 3 failed; 0 ignored; 0 measured; 0 filtered out; finished in 2.15s",
  "project": "mycelium",
  "project_root": "/Users/dev/projects/mycelium",
  "worktree_id": "main",
  "ttl_hours": 4
}
